season,episode_num,title,description,duration,published_date,url,explicit
1995,1,New Beginnings,"Ira talks with Joe Franklin, host of the longest running talk show in television history, to get advice for his new radio show. (6 minutes)

After he goes to Jerusalem and sleeps on what is supposedly the very spot where Jesus was crucified, Kevin Kelly has a revelation: that he should live the next six months as if he would die at the end of them. So he gives away nearly everything he owns, and tries to live each day as if his death is imminent — which turns out to be a great challenge. This story was eventually used in a much later program, Shoulda Been Dead. At the time of this interview, Kevin Kelly was executive editor of Wired magazine. Now he's a contributing editor there, and also runs the Cool Tools website. (23 minutes)

Ira calls his parents Shirley Glass and Barry Glass in Baltimore to ask them for advice about his new radio show. (7 minutes)

When filmmaker and performance artist Lawrence Steger found out he was HIV positive, he was just about to go out on across country road trip with a friend of his. (13 minutes)

Ira talks with Ed Ryder, who was wrongly imprisoned for twenty years and recently released. The whole time Ryder was in prison, he dreamt of starting up a band. Now, out of prison, he's done just that. Ira asks him if music means different things to him now that his future is more his own. We replayed his rendition of ""God Bless the Child"" in the show Lockup. (9 minutes)

",60,"Nov 17, 1995",http://www.thisamericanlife.org/Radio_Episode.aspx?episode=1,""
1995,2,Small Scale Sin,"The Golden Peacock. Playwright Jeff Dorchen creates an original radio play inspired by the musings of the three boys in the previous story. (10 minutes)

Poet Michael Warr talks with Ira and reads some of his poems inspired by his childhood. Warr grew up as a Jehovah's Witness and found that he had some problems with the religion's rules.  He is the author of several books of poetry. (8 minutes)

In the 1990s, Eli was a member of MOD, one of the most infamous and accomplished computer hacking groups in history. He was eventually arrested and served time in a minimum-security prison and home confinement. It turns out that the very sins he committed that led him to serve time were more in demand in prison than they ever were on the outside. (26 minutes)

",60,"Nov 24, 1995",http://www.thisamericanlife.org/Radio_Episode.aspx?episode=2,""
1995,3,Poultry Slam 1995,"Duki's story. When Danielle's family serves poultry at their dinner table, no one utters the word ""chicken."" Instead, it is always called ""fish."" Danielle explains why with the help of her friend ""Duki."" (20 minutes)

Julie Showalter, who grew up on a turkey farm, tells the story of the night 3,000 turkeys died. (8 minutes)

A poultry-themed poem by Luis Rodriguez. (4 minutes)

Verda Mae Grosvenor, host of NPR's Seasonings, shows Ira how to tell a chicken is done simply by listening the sound of the grease. (6 minutes)

Writer David Sedaris tells of the giddiness he felt when he purchased a taxidermy turkey head — attached to its foot. (3 minutes)

",60,"Dec 1, 1995",http://www.thisamericanlife.org/Radio_Episode.aspx?episode=3,""
1995,4,Vacations,"Host Ira Glass shares photos (on the radio) of his family vacation in Hawaii. He poses the question: What can families do on vacation that make them feel closer? (9 minutes)

Writer/singer/performer Sandra Tsing Loh reads a story about a family vacation arranged by her mother, who believed that vacations couldn't be merely for leisure—they had to be educational. Which is how the family ended up vacationing in...Ethiopia. (22 minutes)

Contributor David Sedaris tells a story about discovering the possibilities—and pitfalls—of travel by hitchhiking. (25 minutes)

",60,"Dec 8, 1995",http://www.thisamericanlife.org/Radio_Episode.aspx?episode=4,""
1995,5,Anger and Forgiveness,"Former Harpers magazine editor and TAL contributor Jack Hitt wrote an editorial about Susan Smith, who murdered her two children in South Carolina. The editorial redirected the rage from Smith toward Hitt. One of the countless angered readers of Hitt's piece gets a chance to confront him about his plea for forgiveness for Susan Smith. (15 minutes)

Performance artists Iris Moore and Larry Steeger provide monologues on forgiveness. Larry's was based on the testimony of serial murderer Jeffrey Dahmer.

In the last few years, laws and sentencing guidelines have become much harsher. Sociologically this has had some good effects. Chicago attorney Darron Bowden presents a more negative effect to such inflexibility in the case of the sentencing of one 13-year-old boy. (6 minutes)

Glen Fitzgerald, a Chicago missionary who works with gang members, talks about his concept of forgiveness, and how important it is to being Christian. (9 minutes)

A story by Cheryl Trykv, read by the author in front of a live audience at The Hothouse, illustrates what it means when the sinner makes no attempt to seek forgiveness. (14 minutes)

",60,"Dec 15, 1995",http://www.thisamericanlife.org/Radio_Episode.aspx?episode=5,""
1995,6,Christmas,"A Christmas tree story by Chicago playwright/musician Beau O'Reilly. (14 minutes)

A story about Christmas at Juvenile Court by Chicago novelist/editor Reginald Gibbons. (10 minutes)

Peter Clowney reports on Christmas at the Faith Tabernacle Baptist Church.

Music from Faith Tabernacle Baptist Church all through the hour. (9 minutes)

",60,"Dec 22, 1995",http://www.thisamericanlife.org/Radio_Episode.aspx?episode=6,""
1995,7,Quitting,"Evan Harris was entrenched in her life, stalled and going nowhere both personally and professionally. A silly conversation with a co-worker about the letter ""Q"" led her to start a magazine called Quitter Quarterly. That one conversation changed her life completely. (22 minutes)

A story about quitting by Sandra Tsing Loh. (10 minutes)

Ira explores the question of when it's time to quit a relationship through rare recordings of bickering between roommates—recorded by the next-door neighbors. (9 minutes)

Lisa Buscani reads a two-part story about not being able to quit something or someone. The piece was written for This American Life. (13 minutes)

Dwight Okita reads the poem ""Farewell Samba"" from his book Crossing with the Light.

Ira Glass reads Philip Larkin's poem ""Poetry of Departures."" (3 minutes)

",60,"Dec 29, 1995",http://www.thisamericanlife.org/Radio_Episode.aspx?episode=7,""
1996,8,New Year,"Eighteen-year-old Claudia Perez takes Ira on a tour of her Chicago neighborhood and looks at what 1995 was like for her community. (18 minutes)

Ira talks with Karen Hutt, Director of Religious Education for the First Unitarian Church of Chicago, who one Sunday gave a sermon at the church about her experience as the first black child to integrate the Philadelphia public school system. The sermon inspired a project: Hutt, along with Laura Finnegan, collected an oral history of the experiences of African American members of the congregation about their own experiences as the ""first"" integrators of their neighborhoods or organizations. (31 minutes)

Claudia Perez returns to talk about her year from a more personal perspective. (7 minutes)

",60,"Jan 3, 1996",http://www.thisamericanlife.org/Radio_Episode.aspx?episode=8,""
1996,9,Julia Sweeney,"Julia talks about her brother Michael's cancer. He was diagnosed with non-Hodgkins lymphoma, stage four. He had no insurance. Julia took care of him, and he and her parents moved into her house to be near a cancer treatment center. (25 minutes)

In the second half of the show, she talks about her own cancer — cervical cancer that was diagnosed six months after her brother got sick. Julia eventually turned some of these vignettes into a one-woman show called God Said, Ha!, which Quentin Tarantino made into a movie and Julia released as a book. The comedy club where she performed, Un-Cabaret, is devoted to getting very funny people to tell unusually honest stories. Julia's latest one-woman show is called Letting Go of God, excerpts of which are heard in our episode Godless America. (25 minutes)

",60,"Jan 10, 1996",http://www.thisamericanlife.org/Radio_Episode.aspx?episode=9,""
1996,10,Double Lives,"A talk with a father who's deceiving his own children. (15 minutes)

Sketches from the neo-futurists on the subject of double lives.

 Then, host Ira Glass discovers that his mom is being quoted in national magazines as a ""sexpert."" (12 minutes)

Susan Bergman returns to read an excerpt from her book. (8 minutes)

",60,"Jan 17, 1996",http://www.thisamericanlife.org/Radio_Episode.aspx?episode=10,""
1996,11,Enemies,"Bob and Dave were close childhood friends — until their relationship began to lead their peers to believe that it might be more than a friendship. The accusations led to Dave turning on Bob. (11 minutes)

The story of Dave and Bob continues. For reasons that Bob never fully understood, Dave successfully turned everyone in their school against his former friend, even forming clubs devoted to hating Bob. (13 minutes)

Ira reaches current-day Dave, who is a born-again Christian living with his parents. According to Dave, Bob was at fault for the breakdown in their relationship, because Bob had decided to become friends with someone else. He remembers very little of the fight that is so vivid in Bob's memory. (11 minutes)

Sarah Thyre reads author David Sedaris' ""The Last Time You'll Ever Hear from Me,"" a story of the ultimate Machiavellian scheming. (7 minutes)

",60,"Jan 24, 1996",http://www.thisamericanlife.org/Radio_Episode.aspx?episode=11,""
1996,12,Animals,"This American Life contributor Paul Tough visits Catherine Chalmers. She raises small animals and insects in her apartment, feeds them to each other, and photographs them eating each other. (23 minutes)

An original radio drama called ""Kathleen on the Carpet,"" in which animals talk and hold their own ""animal court."" It's a comedy by David Sedaris, starring our own radio theater company, the Pinetree Gang. (14 minutes)

Anthropologists agree that humans stopped being animals when they started walking upright, on two legs. But scientists don't agree on why our ancestors did this. Ten years ago, Scott Carrier decided to do his own research on the subject.  He is the author of Running After Antelope.  (13 minutes)

",60,"Jan 31, 1996",http://www.thisamericanlife.org/Radio_Episode.aspx?episode=12,""
1996,13,Love,"Host Ira Glass explores a self-help cassette tape that promises to bring the listener peace about being single. The only problem is that it achieves this by having you envision your perfect romantic partner. (13 minutes)

Artist Julie Laffin talks about the inspiration for her ""kissing projects."" Jessica Yu's film Breathing Lessons is about Mark O'Brien, a man using an ""iron lung."" In this excerpt, Mark talks about the yearning he tries to quell through the use of sex surrogates. Poet Luis Rodriguez reads his poem ""Waiting."" Writer Doris Wilbur tells a story of wanting love. (20 minutes)

Audio artist Gregory Whitehead weaves a story of sexual discovery. And This American Life producer Nancy Updike makes an odd discovery about condom use ... or the lack thereof. (15 minutes)

Ira describes a wedding held in the dingy basement room of the City of Chicago's Marriage Court. (10 minutes)

",60,"Feb 7, 1996",http://www.thisamericanlife.org/Radio_Episode.aspx?episode=13,""
1996,14,Accidental Documentaries,"A Midwestern family records a ""letter on tape"" to their son, who is in medical school in California. Three decades later, the recording somehow ends up in a thrift store. The tape gives a complicated portrait of what goes on among the family members. Mother wishes that Father were more religious. Daughter is miffed because Dad won't help her solve her financial problems. Dad tells corny jokes and talks enthusiastically about machines, extrusions and drills used for the family business run from the basement — a business everyone else in the family resents. And after the old tapes, Ira interviews the son they were sending these to, Arthur Davis. (26 minutes)

Ira plays tapes of his own father, Barry, who was a radio deejay in the mid-1950s. Barry gave up spinning records when he decided that he couldn't make a decent living at it, and for over a decade he was against his son going into radio, not wanting him to waste time the way he did. (14 minutes)

Nora Moreno with tapes of her father, a pioneer in Spanish-language broadcasting in America. Her mother fell in love with her father because of his poetic character on the radio, but in real life, the very things that attracted her to him over the radio drove them apart. (13 minutes)

",60,"Feb 21, 1996",http://www.thisamericanlife.org/Radio_Episode.aspx?episode=14,""
1996,15,Dawn,"Who are the people we remember as significant figures from our childhood? What is their hold on our imaginations as we age? Ira visits McCosh Elementary on Chicago's South Side, where a man everyone calls ""Mr. Lewis"" is the surrogate dad for hundreds of kids — a nearly mythic figure. (6 minutes)

Jack Hitt's quest to find out the truth about the man who lived down the street from him 30 years ago in South Carolina: Gordon Langley Hall, a.k.a. Dawn Langley Hall Simmons. Gordon was rumored to have had one of the first sex change operations in America, then to have married a black man, then to have borne the black man's child. It was said he had a full coming-out party for his Chihuahua. It was said he had voodoo powers. Jack's father, the editor of the local paper in Charleston, generally refused to publish anything about Dawn because it was too sensational — even after big city papers and network TV crews decided Dawn was news. Jack sets out to find what was true and what was rumor about Gordon Langley Hall, and stumbles onto a sprawling story about changing cultural morés in America. (Act One continues after the break; total time is about 41 minutes)

Two-and-a-half years after Jack Hitt wrote the story that makes up Act One of our show, he returned to the tale of Dawn Langley Simmons. He brings us up to date on his new conclusions.

",60,"Feb 28, 1996",http://www.thisamericanlife.org/Radio_Episode.aspx?episode=15,""
1996,16,Economy,"Host Ira Glass brings together a panel of Republicans to discuss their lack of excitement about then-presumptive Republican Presidential nominee Bob Dole. (13 minutes)

Temporary employment agencies' business has exploded in the last few years as corporations lay off  their full-time employees, especially technical workers. This American Life ""hired"" two temp workers, Lee and Tito, to document their experiences as temps. Ira invites Tito and Lee into the studio to spin some music ""appropriate"" for temp employees. (21 minutes)

Poet/performer Lisa Buscani tells a story about her father. (8 minutes)

Ira takes a look at the remarkably successful $156 million renovation of Chicago's Navy Pier. He talks with seven employees working at the businesses on the pier. (13 minutes)

",60,"Mar 14, 1996",http://www.thisamericanlife.org/Radio_Episode.aspx?episode=16,""
1996,17,Name Change / No Theme,"Host Ira Glass talks changing the name of the show from Your Radio Playhouse and stumbles on a more fundamental truth about naming things: The people with an investment in the name can be incredibly divisive. He consults television talk show host Joe Franklin for advice. Joe actually likes the new name: This American Life. (11 minutes)

Navy Pier's renovation was presented as a success in last week's show, but recent press reveals that the pier is bleeding money. WBEZ personality Aaron Freeman and his kids take Ira on a tour of the pier, looking at it from a child's perspective. (11 minutes)

Barbara Adams, a former member of the Whitewater trial jury, showed up for jury duty wearing a full-scale costume from Star Trek: The Next Generation. Ira dissects a discussion on an Internet mailing list about fandom, inspired by Adams' celebrity. Also: Temple University professor Cindy Patton's childhood infatuation with G.I. Joe dolls concerned her mother, who wanted her daughter doing more traditionally ""girly"" things. As an adult, she decided she wanted her toys back. Her parents were reluctant to give them back to her. She discusses her struggle to recover her ""childhood as a boy."" (21 minutes)

The first in a series of pieces in the coming months on This American Life: Non-journalists covering aspects of the Presidential campaign. First up: Chicago playwright David Isaacson presents a piece on Pat Buchanan. (13 minutes)

",60,"Mar 21, 1996",http://www.thisamericanlife.org/Radio_Episode.aspx?episode=17,""
1996,18,Liars,"The story of a woman whose husband lies to her compulsively. At some point, she starts to ask him questions that'll make him lie to her, just to amuse herself. Also, the story of a guy whose roommate in college in Nebraska insisted he'd grown up with the Kennedys. (30 minutes)

A girl who adored her father tries to figure out what to think after he takes some of her college money and lies to her about it. Also, a woman whose fiancé runs up $10,000 in credit card charges on her Visa card and vanishes. (25 minutes)

",60,"Mar 28, 1996",http://www.thisamericanlife.org/Radio_Episode.aspx?episode=18,""
1996,19,Rich Guys,"Corporate CEO  Maurice ""Morry"" Taylor, Jr. was a Republican candidate for President, and he never had a chance to win the nomination. That didn't stop political reporter and author Michael Lewis from covering Morry's bizarre campaign. Lewis reads from his diaries about life on the road with Morry. (14 minutes)

Jack Hitt reviews the strange case of William Kane, his mistress, his family, and fifteen vials of frozen sperm. (23 minutes)

Michael Lewis continues readings from his diaries of Morry Taylor's Presidential campaign. (14 minutes)

The late Ron Brown, the former U.S. Secretary of Commerce, could have had an easy life, but chose instead to take on stressful, difficult tasks. Brian Gilmore, an attorney and a writer, talks about the collective eulogizing of Brown. (5 minutes)

",60,"Apr 12, 1996",http://www.thisamericanlife.org/Radio_Episode.aspx?episode=19,""
1996,20,From A Distance,"Erika Yeomans sees a young man's photo in an art magazine and decides to track him down. Problem is: he's Dutch, he's a performance artist, and he's dead. Supposedly. That doesn't stop her from creating her own mission to get near him — a mission that turns out to mirror certain things about his life. (The Dutch artist was named Bas Jan Ader.) (17 minutes)

Writer Quincy Troupe talks about how, as a boy, he idolized Miles Davis, and how, as a man, he actually became one of Davis's closest friends. And how his picture of the man changed. (21 minutes)

Eighteen-year-old correspondent Claudia Perez goes to an audition where a thousand Mexican women and girls dress up to play the slain Mexican pop star Selena in an upcoming film about her life. Feelings about Selena run so high that when her fans talk about her, they often cry. (13 minutes)

",60,"Apr 19, 1996",http://www.thisamericanlife.org/Radio_Episode.aspx?episode=20,""
1996,21,Factions,"Scott Carrier documents a group in Manti, Utah, that left the Mormon church and formed its own polygamous church. The members started fighting, broke up, and no longer speak. Scott is the author of Running After Antelope. (20 minutes)

Chicago writer Beau O'Reilly writes about a group of close friends who formed an activist group in the seventies. They split apart because of one woman. (22 minutes)

Ira speaks with Professor Glenn Loury. Loury failed to stand up for a light-skinned friend at a black unity rally in the sixties. He believes that at that moment, their friendship changed. But when Ira tracked the friend down, he remembered it differently. (10 minutes)

",60,"Apr 26, 1996",http://www.thisamericanlife.org/Radio_Episode.aspx?episode=21,""
1996,22,Adult Children,"",60,"May 3, 1996",http://www.thisamericanlife.org/Radio_Episode.aspx?episode=22,""
1996,23,Drama Bug,"David Sedaris reads his story of getting the drama bug. (14 minutes)

Host Ira Glass follows the last month of rehearsals of Oak Park and River Forest High School's production of Neil Simon's Lost In Yonkers. (22 minutes)

David Sedaris continues his story. (10 minutes)

Mark O'Brien is in an iron lung and comes out for short periods of time. What does he do with those precious moments free of the machinery that keeps him alive? He goes to the theater. (6 minutes)

",60,"May 10, 1996",http://www.thisamericanlife.org/Radio_Episode.aspx?episode=23,""
1996,24,Teenaged Girls,"Jo Carol Pierce released a CD, Bad Girls Upset by the Truth, which documents in part her teenage years. Host Ira Glass shares a couple of songs from the CD and some of the stories behind them. (16 minutes)

Chicago writer/musician Rennie Sparks, a member of the independent band The Handsome Family, reads ""Skanks,"" a story of a girl struggling in a situation where some rules are strict, but other rules are up for grabs. (27 minutes)

Producer/sound artist Gregory Whitehead presents his piece ""This Mindless Thing."" (7 minutes)

",60,"May 24, 1996",http://www.thisamericanlife.org/Radio_Episode.aspx?episode=24,""
1996,25,Basketball,"Chicagoans' dreams of the Bulls, including interviews with Chicagoans. (8 minutes)

Documentary story about a South Side Chicago barbershop where men gather to watch basketball. (10 minutes)

Chicago playwright David Isaacson, on hating the Bulls.

Then, Nancy Updike presents a sound portrait of a Philadelphia woman and her basketball trophies. (23 minutes)

Chicago playwright Beau O'Reilly goes with Ira to the Scottie Pippin Dodge Store.

Then, singer/songwriter/playwright Jeff Dorchen on Niketown. (8 minutes)

A Bulls dream from Chicagoan Brett Grossman, and an acoustic guitar cover of Bulls theme music from Chicago musician Rick Karr. (4 minutes)

",60,"Jun 7, 1996",http://www.thisamericanlife.org/Radio_Episode.aspx?episode=25,""
1996,26,Father's Day '96,"Audio artist Jay Allison and writer Dan Robb present an audio montage on the moment Robb's parents divorced. (11 minutes)

Chicago playwright Beau O'Reilly talks about how he reconciled with his estranged father years ago by becoming an alcoholic just like him. (14 minutes)

",60,"Jun 14, 1996",http://www.thisamericanlife.org/Radio_Episode.aspx?episode=26,""
1996,27,The Cruelty of Children,"David Sedaris reads one of his funniest and most affecting stories from his book Naked before a live audience. As an adolescent boy, David feared he might be a homosexual. He explains how his secret plan was to win the lottery and then hire doctors who would purge him of his homosexual impulses. Sometimes kids in his class at school would taunt the boys they thought were sissies, and when they did, he tried to be the loudest and meanest. He figured if he didn't act that way, they'd all turn on him next. Then he goes away to summer camp and meets a boy named Pete, who seems like an outsider in the same way he is. At first they get close. Then Pete turns on him. Sedaris' latest book is Let's Explore Diabetes with Owls. (26 minutes)

Original fiction by Ira Sher about a group of children who find a man trapped in a well but decide not to get him any help. First published in the Chicago Review. (17 minutes)

Author and kindergarten teacher (and MacArthur Genius Grant recipient) Vivian Paley tells the story of an experiment she conducted in her classroom to make children less cruel to each other. She instituted a rule: ""You can't say 'You can't play.'"" In other words, if two children are playing, and a third child comes over and wants to join them, they can't tell him or her to get lost. They can't reject him or her. This is the cause of unending pain in most classrooms and playgrounds. The experiment was a remarkable and immediate success. (11 minutes)

",60,"Jun 21, 1996",http://www.thisamericanlife.org/Radio_Episode.aspx?episode=27,""
1996,28,Detectives,"Ira talks about one of the purest expressions of ordinary folks' desire to be detectives: a child's detective notebook — full of information, secret codes, cases, and an application to become an FBI agent. (10 minutes)

Writer David Sedaris remembers the days his mother and sister played armchair detective, and the odd crime wave that hit their own home. This story, titled ""True Detective,"" appears in David's book Naked. (23 minutes)

Ira went out on surveillance with a real private eye in Chicago expecting it to be drudge work with none of the glamour of movie detectives. He was wrong. (21 minutes)

",60,"Jul 12, 1996",http://www.thisamericanlife.org/Radio_Episode.aspx?episode=28,""
1996,29,Bob Dole,"",60,"Jul 19, 1996",http://www.thisamericanlife.org/Radio_Episode.aspx?episode=29,""
1996,30,Obsession,"A woman obsessed with the number 2. (11 minutes)

A story by Lauren Slater about getting obsessive compulsive disorder. (19 minutes)

An Orthodox Jew talks about whether Hasidic Judaism is like an obsession. (9 minutes)

A story of a woman who made a kitchen out of beads. (10 minutes)

",60,"Jul 26, 1996",http://www.thisamericanlife.org/Radio_Episode.aspx?episode=30,""
